{
  "base_stats": {
    "atk": 20,
    "def": 20,
    "hp": 200,
    "rush": 20
  },
  "canonical_promotion": false,
  "effect": "In [[Kemet]], DMG +2%<br>In [[Kemet]], INTEL gained +2%",
  "file_no": 608,
  "icon_filename": null,
  "id": "tactical_helmet",
  "name": "Tactical Helmet",
  "notes": "Candidate generated from Gear.wiki gearrow template. Manual review required before canonical promotion.",
  "origin": "Exchange {{retext|Ankh|blue",
  "slot": null,
  "source": {
    "file": "game/sources/wiki_gg/Gear.wiki",
    "section": "Realm",
    "subsection": "Blue",
    "type": "wiki_gg",
    "url": "https://supersnail.wiki.gg/wiki/Gear"
  },
  "spreadsheet_links": [],
  "tags": [
    "candidate",
    "dry_run:phase1c5",
    "phase:1c4",
    "source:wiki_gg"
  ],
  "tier_color": "blue"
}
