{
  "base_stats": {
    "atk": 20,
    "def": 20,
    "hp": 600,
    "rush": 60
  },
  "canonical_promotion": false,
  "effect": "In Angel Form, Regen 640 HP each round",
  "file_no": 304,
  "icon_filename": null,
  "id": "lotus_platform_vi",
  "name": "Lotus Platform VI",
  "notes": "Candidate generated from Gear.wiki gearrow template. Manual review required before canonical promotion.",
  "origin": "{{retext|Lotus Platform III|blue",
  "slot": null,
  "source": {
    "file": "game/sources/wiki_gg/Gear.wiki",
    "section": "Form",
    "subsection": "Purple",
    "type": "wiki_gg",
    "url": "https://supersnail.wiki.gg/wiki/Gear"
  },
  "spreadsheet_links": [],
  "tags": [
    "candidate",
    "dry_run:phase1c5",
    "phase:1c4",
    "source:wiki_gg"
  ],
  "tier_color": "purple"
}
