{
  "base_stats": {
    "atk": 0,
    "def": 10,
    "hp": 100,
    "rush": 0
  },
  "canonical_promotion": false,
  "effect": null,
  "file_no": 2,
  "icon_filename": null,
  "id": "wooden_ring",
  "name": "Wooden Ring",
  "notes": "Candidate generated from Gear.wiki gearrow template. Manual review required before canonical promotion.",
  "origin": "• [[Fissure",
  "slot": null,
  "source": {
    "file": "game/sources/wiki_gg/Gear.wiki",
    "section": "Material",
    "subsection": "White",
    "type": "wiki_gg",
    "url": "https://supersnail.wiki.gg/wiki/Gear"
  },
  "spreadsheet_links": [],
  "tags": [
    "candidate",
    "dry_run:phase1c5",
    "phase:1c4",
    "source:wiki_gg"
  ],
  "tier_color": "gray"
}
