{
  "base_stats": {
    "atk": 15,
    "def": 5,
    "hp": 50,
    "rush": 15
  },
  "canonical_promotion": false,
  "effect": null,
  "file_no": 6,
  "icon_filename": null,
  "id": "warrior_ring",
  "name": "Warrior Ring",
  "notes": "Candidate generated from Gear.wiki gearrow template. Manual review required before canonical promotion.",
  "origin": "• Iron Ring + Beast Fang<br>• Lottery Machine (0.67% chance)<br>• Gear Chest (0.8% chance)<br>• Divine Chests (0.9% chance)",
  "slot": null,
  "source": {
    "file": "game/sources/wiki_gg/Gear.wiki",
    "section": "Material",
    "subsection": "Green",
    "type": "wiki_gg",
    "url": "https://supersnail.wiki.gg/wiki/Gear"
  },
  "spreadsheet_links": [],
  "tags": [
    "candidate",
    "dry_run:phase1c5",
    "phase:1c4",
    "source:wiki_gg"
  ],
  "tier_color": "green"
}
