{
  "base_stats": {
    "atk": 20,
    "def": 0,
    "hp": 0,
    "rush": 0
  },
  "canonical_promotion": false,
  "effect": "In [[Koryeo]], INTEL gained +1%",
  "file_no": 109,
  "icon_filename": null,
  "id": "ice_skates",
  "name": "Ice Skates",
  "notes": "Candidate generated from Gear.wiki gearrow template. Manual review required before canonical promotion.",
  "origin": "Exchange Kimchi Jar x5 in [[Koryeo]]",
  "slot": null,
  "source": {
    "file": "game/sources/wiki_gg/Gear.wiki",
    "section": "Realm",
    "subsection": "White",
    "type": "wiki_gg",
    "url": "https://supersnail.wiki.gg/wiki/Gear"
  },
  "spreadsheet_links": [],
  "tags": [
    "candidate",
    "dry_run:phase1c5",
    "phase:1c4",
    "source:wiki_gg"
  ],
  "tier_color": "gray"
}
