{
  "base_stats": {
    "atk": 80,
    "def": 80,
    "hp": 800,
    "rush": 80
  },
  "canonical_promotion": false,
  "effect": null,
  "file_no": 776,
  "icon_filename": null,
  "id": "blasphemy_eye",
  "name": "Blasphemy Eye",
  "notes": "Candidate generated from Gear.wiki gearrow template. Manual review required before canonical promotion.",
  "origin": "Random Events, Sunday Stars 59.99$, and other misc Gear Bags",
  "slot": null,
  "source": {
    "file": "game/sources/wiki_gg/Gear.wiki",
    "section": "Material",
    "subsection": "Orange",
    "type": "wiki_gg",
    "url": "https://supersnail.wiki.gg/wiki/Gear"
  },
  "spreadsheet_links": [],
  "tags": [
    "candidate",
    "dry_run:phase1c5",
    "phase:1c4",
    "source:wiki_gg"
  ],
  "tier_color": "orange"
}
