{
  "base_stats": {
    "atk": 200,
    "def": 40,
    "hp": 400,
    "rush": 200
  },
  "canonical_promotion": false,
  "effect": "Poison DMG +240<br>Crit Rate +8%",
  "file_no": 67,
  "icon_filename": null,
  "id": "drazgul_fang",
  "name": "Drazgul Fang",
  "notes": "Candidate generated from Gear.wiki gearrow template. Manual review required before canonical promotion.",
  "origin": "Gear Value Pack III(100$!!!)",
  "slot": null,
  "source": {
    "file": "game/sources/wiki_gg/Gear.wiki",
    "section": "Instrument",
    "subsection": "Orange",
    "type": "wiki_gg",
    "url": "https://supersnail.wiki.gg/wiki/Gear"
  },
  "spreadsheet_links": [],
  "tags": [
    "candidate",
    "dry_run:phase1c5",
    "phase:1c4",
    "source:wiki_gg"
  ],
  "tier_color": "orange"
}
