{
  "base_stats": {
    "atk": 0,
    "def": 10,
    "hp": 300,
    "rush": 0
  },
  "canonical_promotion": false,
  "effect": "In [[Britland]], DMG +2%",
  "file_no": 507,
  "icon_filename": null,
  "id": "royal_guard_bearskin_hat",
  "name": "Royal Guard Bearskin Hat",
  "notes": "Candidate generated from Gear.wiki gearrow template. Manual review required before canonical promotion.",
  "origin": "Exchange {{retext|Anchor|green",
  "slot": null,
  "source": {
    "file": "game/sources/wiki_gg/Gear.wiki",
    "section": "Realm",
    "subsection": "Green",
    "type": "wiki_gg",
    "url": "https://supersnail.wiki.gg/wiki/Gear"
  },
  "spreadsheet_links": [],
  "tags": [
    "candidate",
    "dry_run:phase1c5",
    "phase:1c4",
    "source:wiki_gg"
  ],
  "tier_color": "green"
}
