{
  "base_stats": {
    "atk": 120,
    "def": 40,
    "hp": 400,
    "rush": 120
  },
  "canonical_promotion": false,
  "effect": "In [[Hellas]], INTEL gained +8%<br>In [[Hellas]], DMG +8%<br>Every Costume Stat +8%",
  "file_no": 702,
  "icon_filename": null,
  "id": "stardust_arrow",
  "name": "Stardust Arrow",
  "notes": "Candidate generated from Gear.wiki gearrow template. Manual review required before canonical promotion.",
  "origin": "{{retext|Hector's Spear|purple",
  "slot": null,
  "source": {
    "file": "game/sources/wiki_gg/Gear.wiki",
    "section": "Realm",
    "subsection": "Orange",
    "type": "wiki_gg",
    "url": "https://supersnail.wiki.gg/wiki/Gear"
  },
  "spreadsheet_links": [],
  "tags": [
    "candidate",
    "dry_run:phase1c5",
    "phase:1c4",
    "source:wiki_gg"
  ],
  "tier_color": "orange"
}
