{
  "base_stats": {
    "atk": 180,
    "def": 60,
    "hp": 600,
    "rush": 180
  },
  "canonical_promotion": false,
  "effect": "In [[Hellas]], Snail ATK +120<br>In [[Hellas]], Snail DEF +120<br>In [[Hellas]], DMG +12%<br>In [[Hellas]], INTEL gained +12%<br>Every Costume Stat +12%",
  "file_no": 700,
  "icon_filename": null,
  "id": "athena_s_spear",
  "name": "Athena's Spear",
  "notes": "Candidate generated from Gear.wiki gearrow template. Manual review required before canonical promotion.",
  "origin": "{{retext|Stardust Arrow|orange",
  "slot": null,
  "source": {
    "file": "game/sources/wiki_gg/Gear.wiki",
    "section": "Realm",
    "subsection": "Red",
    "type": "wiki_gg",
    "url": "https://supersnail.wiki.gg/wiki/Gear"
  },
  "spreadsheet_links": [],
  "tags": [
    "candidate",
    "dry_run:phase1c5",
    "phase:1c4",
    "source:wiki_gg"
  ],
  "tier_color": "red"
}
