{
  "base_stats": {
    "atk": 10,
    "def": 30,
    "hp": 300,
    "rush": 10
  },
  "canonical_promotion": false,
  "effect": "Dodge Rate +2%",
  "file_no": 23,
  "icon_filename": null,
  "id": "workout_top",
  "name": "Workout Top",
  "notes": "Candidate generated from Gear.wiki gearrow template. Manual review required before canonical promotion.",
  "origin": "Lottery 0.71%",
  "slot": null,
  "source": {
    "file": "game/sources/wiki_gg/Gear.wiki",
    "section": "Armor",
    "subsection": "Blue",
    "type": "wiki_gg",
    "url": "https://supersnail.wiki.gg/wiki/Gear"
  },
  "spreadsheet_links": [],
  "tags": [
    "candidate",
    "dry_run:phase1c5",
    "phase:1c4",
    "source:wiki_gg"
  ],
  "tier_color": "orange"
}
