{
  "base_stats": {
    "atk": 60,
    "def": 60,
    "hp": 600,
    "rush": 300
  },
  "canonical_promotion": false,
  "effect": "Upon traveling through an area: Gain 120 Intel",
  "file_no": 912,
  "icon_filename": null,
  "id": "the_great_engineer",
  "name": "The Great Engineer",
  "notes": "Candidate generated from Gear.wiki gearrow template. Manual review required before canonical promotion.",
  "origin": "{{retext|Gear Ring|orange",
  "slot": null,
  "source": {
    "file": "game/sources/wiki_gg/Gear.wiki",
    "section": "Realm",
    "subsection": "Red",
    "type": "wiki_gg",
    "url": "https://supersnail.wiki.gg/wiki/Gear"
  },
  "spreadsheet_links": [],
  "tags": [
    "candidate",
    "dry_run:phase1c5",
    "phase:1c4",
    "source:wiki_gg"
  ],
  "tier_color": "red"
}
