{
  "base_stats": {
    "atk": 20,
    "def": 60,
    "hp": 600,
    "rush": 20
  },
  "canonical_promotion": false,
  "effect": "In [[Kemet]], Snail DEF +60",
  "file_no": 605,
  "icon_filename": null,
  "id": "pharaoh_s_scepter",
  "name": "Pharaoh's Scepter",
  "notes": "Candidate generated from Gear.wiki gearrow template. Manual review required before canonical promotion.",
  "origin": "Reward of [[Kemet]] INTEL",
  "slot": null,
  "source": {
    "file": "game/sources/wiki_gg/Gear.wiki",
    "section": "Realm",
    "subsection": "Purple",
    "type": "wiki_gg",
    "url": "https://supersnail.wiki.gg/wiki/Gear"
  },
  "spreadsheet_links": [],
  "tags": [
    "candidate",
    "dry_run:phase1c5",
    "phase:1c4",
    "source:wiki_gg"
  ],
  "tier_color": "purple"
}
