{
  "base_stats": {
    "atk": 0,
    "def": 10,
    "hp": 300,
    "rush": 0
  },
  "canonical_promotion": false,
  "effect": "In the [[Time Rift",
  "file_no": 1004,
  "icon_filename": null,
  "id": "time_cog",
  "name": "Time Cog",
  "notes": "Candidate generated from Gear.wiki gearrow template. Manual review required before canonical promotion.",
  "origin": "Rift]], DMG +2%",
  "slot": null,
  "source": {
    "file": "game/sources/wiki_gg/Gear.wiki",
    "section": "Realm",
    "subsection": "Green",
    "type": "wiki_gg",
    "url": "https://supersnail.wiki.gg/wiki/Gear"
  },
  "spreadsheet_links": [],
  "tags": [
    "candidate",
    "dry_run:phase1c5",
    "phase:1c4",
    "source:wiki_gg"
  ],
  "tier_color": "green"
}
