{
  "base_stats": {
    "atk": 60,
    "def": 60,
    "hp": 1800,
    "rush": 180
  },
  "canonical_promotion": false,
  "effect": "In any Realm, 2x Demon God Cell Drops +12%",
  "file_no": 910,
  "icon_filename": null,
  "id": "deepsea_helmet",
  "name": "Deepsea Helmet",
  "notes": "Candidate generated from Gear.wiki gearrow template. Manual review required before canonical promotion.",
  "origin": "{{retext|Diver|orange",
  "slot": null,
  "source": {
    "file": "game/sources/wiki_gg/Gear.wiki",
    "section": "Realm",
    "subsection": "Red",
    "type": "wiki_gg",
    "url": "https://supersnail.wiki.gg/wiki/Gear"
  },
  "spreadsheet_links": [],
  "tags": [
    "candidate",
    "dry_run:phase1c5",
    "phase:1c4",
    "source:wiki_gg"
  ],
  "tier_color": "red"
}
