{
  "base_stats": {
    "atk": 50,
    "def": 10,
    "hp": 100,
    "rush": 10
  },
  "canonical_promotion": false,
  "effect": "Fire, Water, Earth, Wind DMG +30",
  "file_no": 5,
  "icon_filename": null,
  "id": "walnut_wand",
  "name": "Walnut Wand",
  "notes": "Candidate generated from Gear.wiki gearrow template. Manual review required before canonical promotion.",
  "origin": "Old Wizard victory reward",
  "slot": null,
  "source": {
    "file": "game/sources/wiki_gg/Gear.wiki",
    "section": "Instrument",
    "subsection": "Blue",
    "type": "wiki_gg",
    "url": "https://supersnail.wiki.gg/wiki/Gear"
  },
  "spreadsheet_links": [],
  "tags": [
    "candidate",
    "dry_run:phase1c5",
    "phase:1c4",
    "source:wiki_gg"
  ],
  "tier_color": "orange"
}
